
*** Running vivado
    with args -log seg7x16.vds -m64 -mode batch -messageDb vivado.pb -notrace -source seg7x16.tcl


****** Vivado v2016.2 (64-bit)
  **** SW Build 1577090 on Thu Jun  2 16:32:40 MDT 2016
  **** IP Build 1577682 on Fri Jun  3 12:00:54 MDT 2016
    ** Copyright 1986-2016 Xilinx, Inc. All Rights Reserved.

source seg7x16.tcl -notrace
Command: synth_design -top seg7x16 -part xc7a100tcsg324-1
Starting synth_design
Attempting to get a license for feature 'Synthesis' and/or device 'xc7a100t'
INFO: [Common 17-349] Got license for feature 'Synthesis' and/or device 'xc7a100t'
INFO: Launching helper process for spawning children vivado processes
INFO: Helper process launched with PID 38872 
---------------------------------------------------------------------------------
Starting RTL Elaboration : Time (s): cpu = 00:00:03 ; elapsed = 00:00:06 . Memory (MB): peak = 306.797 ; gain = 99.438
---------------------------------------------------------------------------------
INFO: [Synth 8-638] synthesizing module 'seg7x16' [E:/github/cpu31/project_1/project_1.srcs/sources_1/new/seg7x16.v:21]
INFO: [Synth 8-638] synthesizing module 'sccomp_dataflow' [E:/github/cpu31/project_1/project_1.srcs/sources_1/new/top.v:2]
INFO: [Synth 8-638] synthesizing module 'divider' [E:/github/cpu31/project_1/project_1.runs/synth_1/.Xil/Vivado-15868-Nicolas-ainski/realtime/divider_stub.v:5]
INFO: [Synth 8-256] done synthesizing module 'divider' (1#1) [E:/github/cpu31/project_1/project_1.runs/synth_1/.Xil/Vivado-15868-Nicolas-ainski/realtime/divider_stub.v:5]
WARNING: [Synth 8-350] instance 'divider_inst' of module 'divider' requires 4 connections, but only 2 given [E:/github/cpu31/project_1/project_1.srcs/sources_1/new/top.v:59]
INFO: [Synth 8-638] synthesizing module 'cpu' [E:/github/cpu31/project_1/project_1.srcs/sources_1/new/cpu.v:2]
INFO: [Synth 8-638] synthesizing module 'alu' [E:/github/cpu31/project_1/project_1.srcs/sources_1/new/ALU.v:2]
INFO: [Synth 8-256] done synthesizing module 'alu' (2#1) [E:/github/cpu31/project_1/project_1.srcs/sources_1/new/ALU.v:2]
INFO: [Synth 8-638] synthesizing module 'controller' [E:/github/cpu31/project_1/project_1.srcs/sources_1/new/controller.v:2]
	Parameter add bound to: 6'b100000 
	Parameter addu bound to: 6'b100001 
	Parameter sub bound to: 6'b100010 
	Parameter subu bound to: 6'b100011 
	Parameter and_op bound to: 6'b100100 
	Parameter or_op bound to: 6'b100101 
	Parameter xor_op bound to: 6'b100110 
	Parameter nor_op bound to: 6'b100111 
	Parameter slt bound to: 6'b101010 
	Parameter sltu bound to: 6'b101011 
	Parameter sll bound to: 6'b000000 
	Parameter srl bound to: 6'b000010 
	Parameter sra bound to: 6'b000011 
	Parameter sllv bound to: 6'b000100 
	Parameter srlv bound to: 6'b000110 
	Parameter srav bound to: 6'b000111 
	Parameter jr bound to: 6'b001000 
	Parameter addi bound to: 6'b001000 
	Parameter addiu bound to: 6'b001001 
	Parameter andi bound to: 6'b001100 
	Parameter ori bound to: 6'b001101 
	Parameter xori bound to: 6'b001110 
	Parameter lw bound to: 6'b100011 
	Parameter sw bound to: 6'b101011 
	Parameter beq bound to: 6'b000100 
	Parameter bne bound to: 6'b000101 
	Parameter slti bound to: 6'b001010 
	Parameter sltiu bound to: 6'b001011 
	Parameter lui bound to: 6'b001111 
	Parameter j bound to: 6'b000010 
	Parameter jal bound to: 6'b000011 
	Parameter add_aluc bound to: 4'b0010 
	Parameter addu_aluc bound to: 4'b0000 
	Parameter sub_aluc bound to: 4'b0011 
	Parameter subu_aluc bound to: 4'b0001 
	Parameter and_aluc bound to: 4'b0100 
	Parameter or_aluc bound to: 4'b0101 
	Parameter xor_aluc bound to: 4'b0110 
	Parameter nor_aluc bound to: 4'b0111 
	Parameter slt_aluc bound to: 4'b1011 
	Parameter sltu_aluc bound to: 4'b1010 
	Parameter sll_aluc bound to: 4'b1110 
	Parameter srl_aluc bound to: 4'b1101 
	Parameter sra_aluc bound to: 4'b1100 
	Parameter lui_aluc bound to: 4'b1000 
INFO: [Synth 8-256] done synthesizing module 'controller' (3#1) [E:/github/cpu31/project_1/project_1.srcs/sources_1/new/controller.v:2]
INFO: [Synth 8-638] synthesizing module 'DMEM' [E:/github/cpu31/project_1/project_1.srcs/sources_1/new/DMEM.v:2]
INFO: [Synth 8-256] done synthesizing module 'DMEM' (4#1) [E:/github/cpu31/project_1/project_1.srcs/sources_1/new/DMEM.v:2]
INFO: [Synth 8-638] synthesizing module 'imdt_ext' [E:/github/cpu31/project_1/project_1.srcs/sources_1/new/imdt_ext.v:2]
INFO: [Synth 8-256] done synthesizing module 'imdt_ext' (5#1) [E:/github/cpu31/project_1/project_1.srcs/sources_1/new/imdt_ext.v:2]
INFO: [Synth 8-638] synthesizing module 'IMEM' [E:/github/cpu31/project_1/project_1.srcs/sources_1/new/IMEMtop.v:2]
INFO: [Synth 8-638] synthesizing module 'imem' [E:/github/cpu31/project_1/project_1.runs/synth_1/.Xil/Vivado-15868-Nicolas-ainski/realtime/imem_stub.v:6]
INFO: [Synth 8-256] done synthesizing module 'imem' (6#1) [E:/github/cpu31/project_1/project_1.runs/synth_1/.Xil/Vivado-15868-Nicolas-ainski/realtime/imem_stub.v:6]
INFO: [Synth 8-256] done synthesizing module 'IMEM' (7#1) [E:/github/cpu31/project_1/project_1.srcs/sources_1/new/IMEMtop.v:2]
INFO: [Synth 8-638] synthesizing module 'jextend' [E:/github/cpu31/project_1/project_1.srcs/sources_1/new/Jextend.v:2]
INFO: [Synth 8-256] done synthesizing module 'jextend' (8#1) [E:/github/cpu31/project_1/project_1.srcs/sources_1/new/Jextend.v:2]
INFO: [Synth 8-638] synthesizing module 'mux1' [E:/github/cpu31/project_1/project_1.srcs/sources_1/new/mux1.v:2]
INFO: [Synth 8-256] done synthesizing module 'mux1' (9#1) [E:/github/cpu31/project_1/project_1.srcs/sources_1/new/mux1.v:2]
INFO: [Synth 8-638] synthesizing module 'mux3' [E:/github/cpu31/project_1/project_1.srcs/sources_1/new/mux3.v:2]
INFO: [Synth 8-256] done synthesizing module 'mux3' (10#1) [E:/github/cpu31/project_1/project_1.srcs/sources_1/new/mux3.v:2]
INFO: [Synth 8-638] synthesizing module 'mux4' [E:/github/cpu31/project_1/project_1.srcs/sources_1/new/mux4.v:2]
INFO: [Synth 8-256] done synthesizing module 'mux4' (11#1) [E:/github/cpu31/project_1/project_1.srcs/sources_1/new/mux4.v:2]
INFO: [Synth 8-638] synthesizing module 'mux5' [E:/github/cpu31/project_1/project_1.srcs/sources_1/new/mux5.v:2]
INFO: [Synth 8-256] done synthesizing module 'mux5' (12#1) [E:/github/cpu31/project_1/project_1.srcs/sources_1/new/mux5.v:2]
INFO: [Synth 8-638] synthesizing module 'mux6' [E:/github/cpu31/project_1/project_1.srcs/sources_1/new/mux6.v:2]
INFO: [Synth 8-256] done synthesizing module 'mux6' (13#1) [E:/github/cpu31/project_1/project_1.srcs/sources_1/new/mux6.v:2]
INFO: [Synth 8-638] synthesizing module 'npcmaker' [E:/github/cpu31/project_1/project_1.srcs/sources_1/new/npcmaker.v:2]
INFO: [Synth 8-256] done synthesizing module 'npcmaker' (14#1) [E:/github/cpu31/project_1/project_1.srcs/sources_1/new/npcmaker.v:2]
INFO: [Synth 8-638] synthesizing module 'pcreg' [E:/github/cpu31/project_1/project_1.srcs/sources_1/new/pc.v:2]
INFO: [Synth 8-256] done synthesizing module 'pcreg' (15#1) [E:/github/cpu31/project_1/project_1.srcs/sources_1/new/pc.v:2]
INFO: [Synth 8-638] synthesizing module 'regfile' [E:/github/cpu31/project_1/project_1.srcs/sources_1/new/regfile.v:2]
INFO: [Synth 8-256] done synthesizing module 'regfile' (16#1) [E:/github/cpu31/project_1/project_1.srcs/sources_1/new/regfile.v:2]
INFO: [Synth 8-638] synthesizing module 'shamt_ext' [E:/github/cpu31/project_1/project_1.srcs/sources_1/new/shamt_ext.v:2]
INFO: [Synth 8-256] done synthesizing module 'shamt_ext' (17#1) [E:/github/cpu31/project_1/project_1.srcs/sources_1/new/shamt_ext.v:2]
INFO: [Synth 8-638] synthesizing module 'mux2' [E:/github/cpu31/project_1/project_1.srcs/sources_1/new/mux2.v:2]
INFO: [Synth 8-256] done synthesizing module 'mux2' (18#1) [E:/github/cpu31/project_1/project_1.srcs/sources_1/new/mux2.v:2]
WARNING: [Synth 8-3848] Net RF_CLK_t in module/entity cpu does not have driver. [E:/github/cpu31/project_1/project_1.srcs/sources_1/new/cpu.v:89]
INFO: [Synth 8-256] done synthesizing module 'cpu' (19#1) [E:/github/cpu31/project_1/project_1.srcs/sources_1/new/cpu.v:2]
INFO: [Synth 8-256] done synthesizing module 'sccomp_dataflow' (20#1) [E:/github/cpu31/project_1/project_1.srcs/sources_1/new/top.v:2]
WARNING: [Synth 8-350] instance 'cpu_inst' of module 'sccomp_dataflow' requires 80 connections, but only 3 given [E:/github/cpu31/project_1/project_1.srcs/sources_1/new/seg7x16.v:30]
INFO: [Synth 8-155] case statement is not full and has no default [E:/github/cpu31/project_1/project_1.srcs/sources_1/new/seg7x16.v:91]
INFO: [Synth 8-256] done synthesizing module 'seg7x16' (21#1) [E:/github/cpu31/project_1/project_1.srcs/sources_1/new/seg7x16.v:21]
WARNING: [Synth 8-3331] design IMEM has unconnected port address[31]
WARNING: [Synth 8-3331] design IMEM has unconnected port address[30]
WARNING: [Synth 8-3331] design IMEM has unconnected port address[29]
WARNING: [Synth 8-3331] design IMEM has unconnected port address[28]
WARNING: [Synth 8-3331] design IMEM has unconnected port address[27]
WARNING: [Synth 8-3331] design IMEM has unconnected port address[26]
WARNING: [Synth 8-3331] design IMEM has unconnected port address[25]
WARNING: [Synth 8-3331] design IMEM has unconnected port address[24]
WARNING: [Synth 8-3331] design IMEM has unconnected port address[23]
WARNING: [Synth 8-3331] design IMEM has unconnected port address[22]
WARNING: [Synth 8-3331] design IMEM has unconnected port address[21]
WARNING: [Synth 8-3331] design IMEM has unconnected port address[20]
WARNING: [Synth 8-3331] design IMEM has unconnected port address[19]
WARNING: [Synth 8-3331] design IMEM has unconnected port address[18]
WARNING: [Synth 8-3331] design IMEM has unconnected port address[17]
WARNING: [Synth 8-3331] design IMEM has unconnected port address[16]
WARNING: [Synth 8-3331] design IMEM has unconnected port address[15]
WARNING: [Synth 8-3331] design IMEM has unconnected port address[14]
WARNING: [Synth 8-3331] design IMEM has unconnected port address[13]
WARNING: [Synth 8-3331] design IMEM has unconnected port address[1]
WARNING: [Synth 8-3331] design IMEM has unconnected port address[0]
WARNING: [Synth 8-3331] design DMEM has unconnected port DMEMaddr[31]
WARNING: [Synth 8-3331] design DMEM has unconnected port DMEMaddr[30]
WARNING: [Synth 8-3331] design DMEM has unconnected port DMEMaddr[29]
WARNING: [Synth 8-3331] design DMEM has unconnected port DMEMaddr[28]
WARNING: [Synth 8-3331] design DMEM has unconnected port DMEMaddr[27]
WARNING: [Synth 8-3331] design DMEM has unconnected port DMEMaddr[26]
WARNING: [Synth 8-3331] design DMEM has unconnected port DMEMaddr[25]
WARNING: [Synth 8-3331] design DMEM has unconnected port DMEMaddr[24]
WARNING: [Synth 8-3331] design DMEM has unconnected port DMEMaddr[23]
WARNING: [Synth 8-3331] design DMEM has unconnected port DMEMaddr[22]
WARNING: [Synth 8-3331] design DMEM has unconnected port DMEMaddr[21]
WARNING: [Synth 8-3331] design DMEM has unconnected port DMEMaddr[20]
WARNING: [Synth 8-3331] design DMEM has unconnected port DMEMaddr[19]
WARNING: [Synth 8-3331] design DMEM has unconnected port DMEMaddr[18]
WARNING: [Synth 8-3331] design DMEM has unconnected port DMEMaddr[17]
WARNING: [Synth 8-3331] design DMEM has unconnected port DMEMaddr[16]
WARNING: [Synth 8-3331] design DMEM has unconnected port DMEMaddr[15]
WARNING: [Synth 8-3331] design DMEM has unconnected port DMEMaddr[14]
WARNING: [Synth 8-3331] design DMEM has unconnected port DMEMaddr[13]
WARNING: [Synth 8-3331] design DMEM has unconnected port DMEMaddr[1]
WARNING: [Synth 8-3331] design DMEM has unconnected port DMEMaddr[0]
WARNING: [Synth 8-3331] design npcmaker has unconnected port imdt[31]
WARNING: [Synth 8-3331] design npcmaker has unconnected port imdt[30]
WARNING: [Synth 8-3331] design jextend has unconnected port index[20]
WARNING: [Synth 8-3331] design cpu has unconnected port RF_CLK
---------------------------------------------------------------------------------
Finished RTL Elaboration : Time (s): cpu = 00:00:04 ; elapsed = 00:00:06 . Memory (MB): peak = 343.352 ; gain = 135.992
---------------------------------------------------------------------------------

Report Check Netlist: 
+------+------------------+-------+---------+-------+------------------+
|      |Item              |Errors |Warnings |Status |Description       |
+------+------------------+-------+---------+-------+------------------+
|1     |multi_driven_nets |      0|        0|Passed |Multi driven nets |
+------+------------------+-------+---------+-------+------------------+
---------------------------------------------------------------------------------
Finished RTL Optimization Phase 1 : Time (s): cpu = 00:00:04 ; elapsed = 00:00:06 . Memory (MB): peak = 343.352 ; gain = 135.992
---------------------------------------------------------------------------------
WARNING: [Project 1-486] Could not resolve non-primitive black box cell 'divider' instantiated as 'cpu_inst/divider_inst' [E:/github/cpu31/project_1/project_1.srcs/sources_1/new/top.v:59]
WARNING: [Project 1-560] Could not resolve non-primitive black box cell 'imem' instantiated as 'cpu_inst/sccpu/imem_inst/imem_ip'. 2 instances of this cell are unresolved black boxes. [E:/github/cpu31/project_1/project_1.srcs/sources_1/new/IMEMtop.v:28]
INFO: [Device 21-403] Loading part xc7a100tcsg324-1
INFO: [Project 1-570] Preparing netlist for logic optimization

Processing XDC Constraints
Initializing timing engine
Parsing XDC File [E:/github/cpu31/project_1/project_1.runs/synth_1/.Xil/Vivado-15868-Nicolas-ainski/dcp/imem_in_context.xdc] for cell 'cpu_inst/sccpu/imem_inst/imem_ip'
Finished Parsing XDC File [E:/github/cpu31/project_1/project_1.runs/synth_1/.Xil/Vivado-15868-Nicolas-ainski/dcp/imem_in_context.xdc] for cell 'cpu_inst/sccpu/imem_inst/imem_ip'
Parsing XDC File [E:/github/cpu31/project_1/project_1.runs/synth_1/.Xil/Vivado-15868-Nicolas-ainski/dcp/imem_in_context.xdc] for cell 'cpu_inst/imem_inst/imem_ip'
Finished Parsing XDC File [E:/github/cpu31/project_1/project_1.runs/synth_1/.Xil/Vivado-15868-Nicolas-ainski/dcp/imem_in_context.xdc] for cell 'cpu_inst/imem_inst/imem_ip'
Parsing XDC File [E:/github/cpu31/project_1/project_1.runs/synth_1/.Xil/Vivado-15868-Nicolas-ainski/dcp_2/divider_in_context.xdc] for cell 'cpu_inst/divider_inst'
Finished Parsing XDC File [E:/github/cpu31/project_1/project_1.runs/synth_1/.Xil/Vivado-15868-Nicolas-ainski/dcp_2/divider_in_context.xdc] for cell 'cpu_inst/divider_inst'
Parsing XDC File [E:/github/cpu31/project_1/project_1.srcs/constrs_1/new/cpu31.xdc]
WARNING: [Vivado 12-584] No ports matched 'clk_in'. [E:/github/cpu31/project_1/project_1.srcs/constrs_1/new/cpu31.xdc:1]
Finished Parsing XDC File [E:/github/cpu31/project_1/project_1.srcs/constrs_1/new/cpu31.xdc]
WARNING: [Project 1-498] One or more constraints failed evaluation while reading constraint file [E:/github/cpu31/project_1/project_1.srcs/constrs_1/new/cpu31.xdc] and the design contains unresolved black boxes. These constraints will be read post-synthesis (as long as their source constraint file is marked as used_in_implementation) and should be applied correctly then. You should review the constraints listed in the file [.Xil/seg7x16_propImpl.xdc] and check the run log file to verify that these constraints were correctly applied.
Parsing XDC File [E:/github/cpu31/project_1/project_1.srcs/sources_1/new/icf.xdc]
WARNING: [Vivado 12-584] No ports matched 'clk_in'. [E:/github/cpu31/project_1/project_1.srcs/sources_1/new/icf.xdc:1]
WARNING: [Vivado 12-584] No ports matched 'clk_in'. [E:/github/cpu31/project_1/project_1.srcs/sources_1/new/icf.xdc:42]
WARNING: [Vivado 12-584] No ports matched 'clk_in'. [E:/github/cpu31/project_1/project_1.srcs/sources_1/new/icf.xdc:44]
CRITICAL WARNING: [Constraints 18-376] set_input_delay: more than one reference clocks specified. [E:/github/cpu31/project_1/project_1.srcs/sources_1/new/icf.xdc:45]
CRITICAL WARNING: [Constraints 18-376] set_output_delay: more than one reference clocks specified. [E:/github/cpu31/project_1/project_1.srcs/sources_1/new/icf.xdc:46]
Finished Parsing XDC File [E:/github/cpu31/project_1/project_1.srcs/sources_1/new/icf.xdc]
WARNING: [Project 1-498] One or more constraints failed evaluation while reading constraint file [E:/github/cpu31/project_1/project_1.srcs/sources_1/new/icf.xdc] and the design contains unresolved black boxes. These constraints will be read post-synthesis (as long as their source constraint file is marked as used_in_implementation) and should be applied correctly then. You should review the constraints listed in the file [.Xil/seg7x16_propImpl.xdc] and check the run log file to verify that these constraints were correctly applied.
INFO: [Project 1-236] Implementation specific constraints were found while reading constraint file [E:/github/cpu31/project_1/project_1.srcs/sources_1/new/icf.xdc]. These constraints will be ignored for synthesis but will be used in implementation. Impacted constraints are listed in the file [.Xil/seg7x16_propImpl.xdc].
Resolution: To avoid this warning, move constraints listed in [.Xil/seg7x16_propImpl.xdc] to another XDC file and exclude this new file from synthesis with the used_in_synthesis property (File Properties dialog in GUI) and re-run elaboration/synthesis.
Completed Processing XDC Constraints

INFO: [Project 1-111] Unisim Transformation Summary:
No Unisim elements were transformed.

Constraint Validation Runtime : Time (s): cpu = 00:00:00 ; elapsed = 00:00:00.005 . Memory (MB): peak = 659.258 ; gain = 0.000
---------------------------------------------------------------------------------
Finished Constraint Validation : Time (s): cpu = 00:00:09 ; elapsed = 00:00:12 . Memory (MB): peak = 659.258 ; gain = 451.898
---------------------------------------------------------------------------------
---------------------------------------------------------------------------------
Start Loading Part and Timing Information
---------------------------------------------------------------------------------
Loading part: xc7a100tcsg324-1
---------------------------------------------------------------------------------
Finished Loading Part and Timing Information : Time (s): cpu = 00:00:09 ; elapsed = 00:00:12 . Memory (MB): peak = 659.258 ; gain = 451.898
---------------------------------------------------------------------------------
---------------------------------------------------------------------------------
Start Applying 'set_property' XDC Constraints
---------------------------------------------------------------------------------
Applied set_property IO_BUFFER_TYPE = NONE for clk. (constraint file  E:/github/cpu31/project_1/project_1.runs/synth_1/.Xil/Vivado-15868-Nicolas-ainski/dcp_2/divider_in_context.xdc, line 3).
Applied set_property CLOCK_BUFFER_TYPE = NONE for clk. (constraint file  E:/github/cpu31/project_1/project_1.runs/synth_1/.Xil/Vivado-15868-Nicolas-ainski/dcp_2/divider_in_context.xdc, line 4).
---------------------------------------------------------------------------------
Finished applying 'set_property' XDC Constraints : Time (s): cpu = 00:00:09 ; elapsed = 00:00:12 . Memory (MB): peak = 659.258 ; gain = 451.898
---------------------------------------------------------------------------------
INFO: [Synth 8-5545] ROM "carry" won't be mapped to RAM because address size (32) is larger than maximum supported(25)
INFO: [Synth 8-5544] ROM "M10" won't be mapped to Block RAM because address size (1) smaller than threshold (5)
INFO: [Synth 8-5544] ROM "M20" won't be mapped to Block RAM because address size (1) smaller than threshold (5)
INFO: [Synth 8-5544] ROM "M30" won't be mapped to Block RAM because address size (1) smaller than threshold (5)
INFO: [Synth 8-5544] ROM "M4" won't be mapped to Block RAM because address size (1) smaller than threshold (5)
INFO: [Synth 8-5544] ROM "M50" won't be mapped to Block RAM because address size (1) smaller than threshold (5)
INFO: [Synth 8-5544] ROM "M6" won't be mapped to Block RAM because address size (1) smaller than threshold (5)
INFO: [Synth 8-5544] ROM "RF_W" won't be mapped to Block RAM because address size (1) smaller than threshold (5)
INFO: [Synth 8-5544] ROM "su" won't be mapped to Block RAM because address size (1) smaller than threshold (5)
INFO: [Synth 8-5544] ROM "CS" won't be mapped to Block RAM because address size (1) smaller than threshold (5)
INFO: [Synth 8-5544] ROM "DM_W" won't be mapped to Block RAM because address size (1) smaller than threshold (5)
INFO: [Synth 8-5544] ROM "DM_R" won't be mapped to Block RAM because address size (1) smaller than threshold (5)
INFO: [Synth 8-5544] ROM "Btype" won't be mapped to Block RAM because address size (1) smaller than threshold (5)
INFO: [Synth 8-5546] ROM "array_reg_reg[0]" won't be mapped to RAM because it is too sparse
INFO: [Synth 8-5546] ROM "array_reg_reg[1]" won't be mapped to RAM because it is too sparse
INFO: [Synth 8-5546] ROM "array_reg_reg[2]" won't be mapped to RAM because it is too sparse
INFO: [Synth 8-5546] ROM "array_reg_reg[3]" won't be mapped to RAM because it is too sparse
INFO: [Synth 8-5546] ROM "array_reg_reg[4]" won't be mapped to RAM because it is too sparse
INFO: [Synth 8-5546] ROM "array_reg_reg[5]" won't be mapped to RAM because it is too sparse
INFO: [Synth 8-5546] ROM "array_reg_reg[6]" won't be mapped to RAM because it is too sparse
INFO: [Synth 8-5546] ROM "array_reg_reg[7]" won't be mapped to RAM because it is too sparse
INFO: [Synth 8-5546] ROM "array_reg_reg[8]" won't be mapped to RAM because it is too sparse
INFO: [Synth 8-5546] ROM "array_reg_reg[9]" won't be mapped to RAM because it is too sparse
INFO: [Synth 8-5546] ROM "array_reg_reg[10]" won't be mapped to RAM because it is too sparse
INFO: [Synth 8-5546] ROM "array_reg_reg[11]" won't be mapped to RAM because it is too sparse
INFO: [Synth 8-5546] ROM "array_reg_reg[12]" won't be mapped to RAM because it is too sparse
INFO: [Synth 8-5546] ROM "array_reg_reg[13]" won't be mapped to RAM because it is too sparse
INFO: [Synth 8-5546] ROM "array_reg_reg[14]" won't be mapped to RAM because it is too sparse
INFO: [Synth 8-5546] ROM "array_reg_reg[15]" won't be mapped to RAM because it is too sparse
INFO: [Synth 8-5546] ROM "array_reg_reg[16]" won't be mapped to RAM because it is too sparse
INFO: [Synth 8-5546] ROM "array_reg_reg[17]" won't be mapped to RAM because it is too sparse
INFO: [Synth 8-5546] ROM "array_reg_reg[18]" won't be mapped to RAM because it is too sparse
INFO: [Synth 8-5546] ROM "array_reg_reg[19]" won't be mapped to RAM because it is too sparse
INFO: [Synth 8-5546] ROM "array_reg_reg[20]" won't be mapped to RAM because it is too sparse
INFO: [Synth 8-5546] ROM "array_reg_reg[21]" won't be mapped to RAM because it is too sparse
INFO: [Synth 8-5546] ROM "array_reg_reg[22]" won't be mapped to RAM because it is too sparse
INFO: [Synth 8-5546] ROM "array_reg_reg[23]" won't be mapped to RAM because it is too sparse
INFO: [Synth 8-5546] ROM "array_reg_reg[24]" won't be mapped to RAM because it is too sparse
INFO: [Synth 8-5546] ROM "array_reg_reg[25]" won't be mapped to RAM because it is too sparse
INFO: [Synth 8-5546] ROM "array_reg_reg[26]" won't be mapped to RAM because it is too sparse
INFO: [Synth 8-5546] ROM "array_reg_reg[27]" won't be mapped to RAM because it is too sparse
INFO: [Synth 8-5546] ROM "array_reg_reg[28]" won't be mapped to RAM because it is too sparse
INFO: [Synth 8-5546] ROM "array_reg_reg[29]" won't be mapped to RAM because it is too sparse
INFO: [Synth 8-5546] ROM "array_reg_reg[30]" won't be mapped to RAM because it is too sparse
INFO: [Synth 8-5546] ROM "array_reg_reg[31]" won't be mapped to RAM because it is too sparse
INFO: [Synth 8-5546] ROM "o_seg_r" won't be mapped to RAM because it is too sparse
---------------------------------------------------------------------------------
Finished RTL Optimization Phase 2 : Time (s): cpu = 00:00:09 ; elapsed = 00:00:12 . Memory (MB): peak = 659.258 ; gain = 451.898
---------------------------------------------------------------------------------

Report RTL Partitions: 
+-+--------------+------------+----------+
| |RTL Partition |Replication |Instances |
+-+--------------+------------+----------+
+-+--------------+------------+----------+
---------------------------------------------------------------------------------
Start RTL Component Statistics 
---------------------------------------------------------------------------------
Detailed RTL Component Info : 
+---Adders : 
	   2 Input     32 Bit       Adders := 7     
	   3 Input     32 Bit       Adders := 2     
	   2 Input      3 Bit       Adders := 1     
+---XORs : 
	   2 Input     32 Bit         XORs := 1     
	   2 Input      1 Bit         XORs := 1     
+---Registers : 
	               32 Bit    Registers := 34    
	                8 Bit    Registers := 1     
	                3 Bit    Registers := 1     
+---RAMs : 
	              64K Bit         RAMs := 2     
+---Muxes : 
	   2 Input     32 Bit        Muxes := 5     
	   4 Input     32 Bit        Muxes := 2     
	   5 Input     32 Bit        Muxes := 1     
	   2 Input      8 Bit        Muxes := 1     
	  16 Input      8 Bit        Muxes := 1     
	   8 Input      8 Bit        Muxes := 1     
	   4 Input      5 Bit        Muxes := 1     
	  14 Input      4 Bit        Muxes := 1     
	   2 Input      2 Bit        Muxes := 3     
	   3 Input      2 Bit        Muxes := 2     
	   2 Input      1 Bit        Muxes := 36    
	  16 Input      1 Bit        Muxes := 1     
---------------------------------------------------------------------------------
Finished RTL Component Statistics 
---------------------------------------------------------------------------------
---------------------------------------------------------------------------------
Start RTL Hierarchical Component Statistics 
---------------------------------------------------------------------------------
Hierarchical RTL Component report 
Module seg7x16 
Detailed RTL Component Info : 
+---Adders : 
	   2 Input      3 Bit       Adders := 1     
+---Registers : 
	               32 Bit    Registers := 1     
	                8 Bit    Registers := 1     
	                3 Bit    Registers := 1     
+---Muxes : 
	   2 Input      8 Bit        Muxes := 1     
	  16 Input      8 Bit        Muxes := 1     
	   8 Input      8 Bit        Muxes := 1     
Module alu 
Detailed RTL Component Info : 
+---Adders : 
	   2 Input     32 Bit       Adders := 2     
	   3 Input     32 Bit       Adders := 2     
+---XORs : 
	   2 Input     32 Bit         XORs := 1     
+---Muxes : 
	   2 Input      1 Bit        Muxes := 2     
	  16 Input      1 Bit        Muxes := 1     
Module controller 
Detailed RTL Component Info : 
+---Muxes : 
	  14 Input      4 Bit        Muxes := 1     
	   2 Input      2 Bit        Muxes := 3     
	   3 Input      2 Bit        Muxes := 2     
	   2 Input      1 Bit        Muxes := 2     
Module DMEM 
Detailed RTL Component Info : 
+---RAMs : 
	              64K Bit         RAMs := 1     
+---Muxes : 
	   2 Input     32 Bit        Muxes := 1     
Module imdt_ext 
Detailed RTL Component Info : 
+---Muxes : 
	   2 Input     32 Bit        Muxes := 1     
Module mux1 
Detailed RTL Component Info : 
+---Adders : 
	   2 Input     32 Bit       Adders := 1     
+---Muxes : 
	   4 Input     32 Bit        Muxes := 1     
Module mux3 
Detailed RTL Component Info : 
+---Muxes : 
	   4 Input      5 Bit        Muxes := 1     
Module mux4 
Detailed RTL Component Info : 
+---Muxes : 
	   2 Input     32 Bit        Muxes := 1     
Module mux5 
Detailed RTL Component Info : 
+---Muxes : 
	   5 Input     32 Bit        Muxes := 1     
Module mux6 
Detailed RTL Component Info : 
+---XORs : 
	   2 Input      1 Bit         XORs := 1     
Module npcmaker 
Detailed RTL Component Info : 
+---Adders : 
	   2 Input     32 Bit       Adders := 1     
+---Muxes : 
	   2 Input     32 Bit        Muxes := 1     
Module pcreg 
Detailed RTL Component Info : 
+---Adders : 
	   2 Input     32 Bit       Adders := 1     
+---Registers : 
	               32 Bit    Registers := 1     
Module regfile 
Detailed RTL Component Info : 
+---Registers : 
	               32 Bit    Registers := 32    
+---Muxes : 
	   2 Input      1 Bit        Muxes := 32    
Module mux2 
Detailed RTL Component Info : 
+---Adders : 
	   2 Input     32 Bit       Adders := 1     
+---Muxes : 
	   4 Input     32 Bit        Muxes := 1     
Module sccomp_dataflow 
Detailed RTL Component Info : 
+---Adders : 
	   2 Input     32 Bit       Adders := 1     
---------------------------------------------------------------------------------
Finished RTL Hierarchical Component Statistics
---------------------------------------------------------------------------------
---------------------------------------------------------------------------------
Start Part Resource Summary
---------------------------------------------------------------------------------
Part Resources:
DSPs: 240 (col length:80)
BRAMs: 270 (col length: RAMB18 80 RAMB36 40)
---------------------------------------------------------------------------------
Finished Part Resource Summary
---------------------------------------------------------------------------------
Start Parallel Synthesis Optimization  : Time (s): cpu = 00:00:09 ; elapsed = 00:00:13 . Memory (MB): peak = 659.258 ; gain = 451.898
---------------------------------------------------------------------------------
Start Cross Boundary Optimization
---------------------------------------------------------------------------------
INFO: [Synth 8-5545] ROM "carry" won't be mapped to RAM because address size (32) is larger than maximum supported(25)
---------------------------------------------------------------------------------
Finished Cross Boundary Optimization : Time (s): cpu = 00:00:09 ; elapsed = 00:00:13 . Memory (MB): peak = 659.258 ; gain = 451.898
---------------------------------------------------------------------------------
Finished Parallel Reinference  : Time (s): cpu = 00:00:09 ; elapsed = 00:00:13 . Memory (MB): peak = 659.258 ; gain = 451.898

Report RTL Partitions: 
+-+--------------+------------+----------+
| |RTL Partition |Replication |Instances |
+-+--------------+------------+----------+
+-+--------------+------------+----------+
---------------------------------------------------------------------------------
Start ROM, RAM, DSP and Shift Register Reporting
---------------------------------------------------------------------------------

Distributed RAM: Preliminary Mapping  Report (see note below)
+------------+-----------------------------------+-----------+----------------------+-------------------+
|Module Name | RTL Object                        | Inference | Size (Depth x Width) | Primitives        | 
+------------+-----------------------------------+-----------+----------------------+-------------------+
|seg7x16     | cpu_inst/sccpu/dmem_inst/DMEM_reg | Implied   | 2 K x 32             | RAM256X1S x 256   | 
|seg7x16     | cpu_inst/dmem_inst/DMEM_reg       | Implied   | 2 K x 32             | RAM256X1S x 256   | 
+------------+-----------------------------------+-----------+----------------------+-------------------+

Note: The table above is a preliminary report that shows the Distributed RAMs at the current stage of the synthesis flow. Some Distributed RAMs may be reimplemented as non Distributed RAM primitives later in the synthesis flow. Multiple instantiated RAMs are reported only once.
---------------------------------------------------------------------------------
Finished ROM, RAM, DSP and Shift Register Reporting
---------------------------------------------------------------------------------
---------------------------------------------------------------------------------
Start Area Optimization
---------------------------------------------------------------------------------
INFO: [Synth 8-3333] propagating constant 1 across sequential element (\o_seg_r_reg[7] )
WARNING: [Synth 8-3332] Sequential element (o_seg_r_reg[7]) is unused and will be removed from module seg7x16.
---------------------------------------------------------------------------------
Finished Area Optimization : Time (s): cpu = 00:00:30 ; elapsed = 00:00:35 . Memory (MB): peak = 659.258 ; gain = 451.898
---------------------------------------------------------------------------------
Finished Parallel Area Optimization  : Time (s): cpu = 00:00:30 ; elapsed = 00:00:35 . Memory (MB): peak = 659.258 ; gain = 451.898

Report RTL Partitions: 
+-+--------------+------------+----------+
| |RTL Partition |Replication |Instances |
+-+--------------+------------+----------+
+-+--------------+------------+----------+
---------------------------------------------------------------------------------
Start Timing Optimization
---------------------------------------------------------------------------------
---------------------------------------------------------------------------------
Start Applying XDC Timing Constraints
---------------------------------------------------------------------------------
INFO: [Synth 8-5578] Moved timing constraint from pin 'cpu_inst/divider_inst/clk_out1' to pin 'cpu_inst/divider_inst/bbstub_clk_out1/O'
INFO: [Synth 8-5820] Moved 1 constraints on hierarchical pins to their respective driving/loading pins
---------------------------------------------------------------------------------
Finished Applying XDC Timing Constraints : Time (s): cpu = 00:00:35 ; elapsed = 00:00:41 . Memory (MB): peak = 659.258 ; gain = 451.898
---------------------------------------------------------------------------------
---------------------------------------------------------------------------------
Finished Timing Optimization : Time (s): cpu = 00:00:41 ; elapsed = 00:00:48 . Memory (MB): peak = 666.770 ; gain = 459.410
---------------------------------------------------------------------------------

Report RTL Partitions: 
+-+--------------+------------+----------+
| |RTL Partition |Replication |Instances |
+-+--------------+------------+----------+
+-+--------------+------------+----------+
---------------------------------------------------------------------------------
Start Technology Mapping
---------------------------------------------------------------------------------
---------------------------------------------------------------------------------
Finished Technology Mapping : Time (s): cpu = 00:00:45 ; elapsed = 00:00:51 . Memory (MB): peak = 725.176 ; gain = 517.816
---------------------------------------------------------------------------------
Finished Parallel Technology Mapping Optimization  : Time (s): cpu = 00:00:45 ; elapsed = 00:00:51 . Memory (MB): peak = 725.176 ; gain = 517.816

Report RTL Partitions: 
+-+--------------+------------+----------+
| |RTL Partition |Replication |Instances |
+-+--------------+------------+----------+
+-+--------------+------------+----------+
Finished Parallel Synthesis Optimization  : Time (s): cpu = 00:00:45 ; elapsed = 00:00:51 . Memory (MB): peak = 725.176 ; gain = 517.816
---------------------------------------------------------------------------------
Start IO Insertion
---------------------------------------------------------------------------------
---------------------------------------------------------------------------------
Start Flattening Before IO Insertion
---------------------------------------------------------------------------------
---------------------------------------------------------------------------------
Finished Flattening Before IO Insertion
---------------------------------------------------------------------------------
---------------------------------------------------------------------------------
Start Final Netlist Cleanup
---------------------------------------------------------------------------------
---------------------------------------------------------------------------------
Finished Final Netlist Cleanup
---------------------------------------------------------------------------------
CRITICAL WARNING: [Synth 8-4442] BlackBox module \cpu_inst/divider_inst  has unconnected pin reset
---------------------------------------------------------------------------------
Finished IO Insertion : Time (s): cpu = 00:00:45 ; elapsed = 00:00:52 . Memory (MB): peak = 725.176 ; gain = 517.816
---------------------------------------------------------------------------------
CRITICAL WARNING: [Synth 8-3352] multi-driven net cpu_inst/imem_inst/instrT[5] with 1st driver pin 'cpu_inst/sccpu/imem_inst/imem_ip/spo[5]' [E:/github/cpu31/project_1/project_1.srcs/sources_1/new/IMEMtop.v:28]
CRITICAL WARNING: [Synth 8-3352] multi-driven net cpu_inst/imem_inst/instrT[5] with 2nd driver pin 'cpu_inst/imem_inst/imem_ip/spo[5]' [E:/github/cpu31/project_1/project_1.srcs/sources_1/new/IMEMtop.v:28]
CRITICAL WARNING: [Synth 8-3352] multi-driven net cpu_inst/imem_inst/instrT[4] with 1st driver pin 'cpu_inst/sccpu/imem_inst/imem_ip/spo[4]' [E:/github/cpu31/project_1/project_1.srcs/sources_1/new/IMEMtop.v:28]
CRITICAL WARNING: [Synth 8-3352] multi-driven net cpu_inst/imem_inst/instrT[4] with 2nd driver pin 'cpu_inst/imem_inst/imem_ip/spo[4]' [E:/github/cpu31/project_1/project_1.srcs/sources_1/new/IMEMtop.v:28]
CRITICAL WARNING: [Synth 8-3352] multi-driven net cpu_inst/imem_inst/instrT[25] with 1st driver pin 'cpu_inst/sccpu/imem_inst/imem_ip/spo[25]' [E:/github/cpu31/project_1/project_1.srcs/sources_1/new/IMEMtop.v:28]
CRITICAL WARNING: [Synth 8-3352] multi-driven net cpu_inst/imem_inst/instrT[25] with 2nd driver pin 'cpu_inst/imem_inst/imem_ip/spo[25]' [E:/github/cpu31/project_1/project_1.srcs/sources_1/new/IMEMtop.v:28]
CRITICAL WARNING: [Synth 8-3352] multi-driven net cpu_inst/imem_inst/instrT[20] with 1st driver pin 'cpu_inst/sccpu/imem_inst/imem_ip/spo[20]' [E:/github/cpu31/project_1/project_1.srcs/sources_1/new/IMEMtop.v:28]
CRITICAL WARNING: [Synth 8-3352] multi-driven net cpu_inst/imem_inst/instrT[20] with 2nd driver pin 'cpu_inst/imem_inst/imem_ip/spo[20]' [E:/github/cpu31/project_1/project_1.srcs/sources_1/new/IMEMtop.v:28]
CRITICAL WARNING: [Synth 8-3352] multi-driven net cpu_inst/imem_inst/instrT[1] with 1st driver pin 'cpu_inst/sccpu/imem_inst/imem_ip/spo[1]' [E:/github/cpu31/project_1/project_1.srcs/sources_1/new/IMEMtop.v:28]
CRITICAL WARNING: [Synth 8-3352] multi-driven net cpu_inst/imem_inst/instrT[1] with 2nd driver pin 'cpu_inst/imem_inst/imem_ip/spo[1]' [E:/github/cpu31/project_1/project_1.srcs/sources_1/new/IMEMtop.v:28]
CRITICAL WARNING: [Synth 8-3352] multi-driven net cpu_inst/imem_inst/instrT[2] with 1st driver pin 'cpu_inst/sccpu/imem_inst/imem_ip/spo[2]' [E:/github/cpu31/project_1/project_1.srcs/sources_1/new/IMEMtop.v:28]
CRITICAL WARNING: [Synth 8-3352] multi-driven net cpu_inst/imem_inst/instrT[2] with 2nd driver pin 'cpu_inst/imem_inst/imem_ip/spo[2]' [E:/github/cpu31/project_1/project_1.srcs/sources_1/new/IMEMtop.v:28]
CRITICAL WARNING: [Synth 8-3352] multi-driven net cpu_inst/imem_inst/instrT[12] with 1st driver pin 'cpu_inst/sccpu/imem_inst/imem_ip/spo[12]' [E:/github/cpu31/project_1/project_1.srcs/sources_1/new/IMEMtop.v:28]
CRITICAL WARNING: [Synth 8-3352] multi-driven net cpu_inst/imem_inst/instrT[12] with 2nd driver pin 'cpu_inst/imem_inst/imem_ip/spo[12]' [E:/github/cpu31/project_1/project_1.srcs/sources_1/new/IMEMtop.v:28]
CRITICAL WARNING: [Synth 8-3352] multi-driven net cpu_inst/imem_inst/instrT[11] with 1st driver pin 'cpu_inst/sccpu/imem_inst/imem_ip/spo[11]' [E:/github/cpu31/project_1/project_1.srcs/sources_1/new/IMEMtop.v:28]
CRITICAL WARNING: [Synth 8-3352] multi-driven net cpu_inst/imem_inst/instrT[11] with 2nd driver pin 'cpu_inst/imem_inst/imem_ip/spo[11]' [E:/github/cpu31/project_1/project_1.srcs/sources_1/new/IMEMtop.v:28]
CRITICAL WARNING: [Synth 8-3352] multi-driven net cpu_inst/imem_inst/instrT[10] with 1st driver pin 'cpu_inst/sccpu/imem_inst/imem_ip/spo[10]' [E:/github/cpu31/project_1/project_1.srcs/sources_1/new/IMEMtop.v:28]
CRITICAL WARNING: [Synth 8-3352] multi-driven net cpu_inst/imem_inst/instrT[10] with 2nd driver pin 'cpu_inst/imem_inst/imem_ip/spo[10]' [E:/github/cpu31/project_1/project_1.srcs/sources_1/new/IMEMtop.v:28]
CRITICAL WARNING: [Synth 8-3352] multi-driven net cpu_inst/imem_inst/instrT[9] with 1st driver pin 'cpu_inst/sccpu/imem_inst/imem_ip/spo[9]' [E:/github/cpu31/project_1/project_1.srcs/sources_1/new/IMEMtop.v:28]
CRITICAL WARNING: [Synth 8-3352] multi-driven net cpu_inst/imem_inst/instrT[9] with 2nd driver pin 'cpu_inst/imem_inst/imem_ip/spo[9]' [E:/github/cpu31/project_1/project_1.srcs/sources_1/new/IMEMtop.v:28]
CRITICAL WARNING: [Synth 8-3352] multi-driven net cpu_inst/imem_inst/instrT[8] with 1st driver pin 'cpu_inst/sccpu/imem_inst/imem_ip/spo[8]' [E:/github/cpu31/project_1/project_1.srcs/sources_1/new/IMEMtop.v:28]
CRITICAL WARNING: [Synth 8-3352] multi-driven net cpu_inst/imem_inst/instrT[8] with 2nd driver pin 'cpu_inst/imem_inst/imem_ip/spo[8]' [E:/github/cpu31/project_1/project_1.srcs/sources_1/new/IMEMtop.v:28]
CRITICAL WARNING: [Synth 8-3352] multi-driven net cpu_inst/imem_inst/instrT[7] with 1st driver pin 'cpu_inst/sccpu/imem_inst/imem_ip/spo[7]' [E:/github/cpu31/project_1/project_1.srcs/sources_1/new/IMEMtop.v:28]
CRITICAL WARNING: [Synth 8-3352] multi-driven net cpu_inst/imem_inst/instrT[7] with 2nd driver pin 'cpu_inst/imem_inst/imem_ip/spo[7]' [E:/github/cpu31/project_1/project_1.srcs/sources_1/new/IMEMtop.v:28]
CRITICAL WARNING: [Synth 8-3352] multi-driven net cpu_inst/imem_inst/instrT[6] with 1st driver pin 'cpu_inst/sccpu/imem_inst/imem_ip/spo[6]' [E:/github/cpu31/project_1/project_1.srcs/sources_1/new/IMEMtop.v:28]
CRITICAL WARNING: [Synth 8-3352] multi-driven net cpu_inst/imem_inst/instrT[6] with 2nd driver pin 'cpu_inst/imem_inst/imem_ip/spo[6]' [E:/github/cpu31/project_1/project_1.srcs/sources_1/new/IMEMtop.v:28]
CRITICAL WARNING: [Synth 8-3352] multi-driven net cpu_inst/imem_inst/instrT[3] with 1st driver pin 'cpu_inst/sccpu/imem_inst/imem_ip/spo[3]' [E:/github/cpu31/project_1/project_1.srcs/sources_1/new/IMEMtop.v:28]
CRITICAL WARNING: [Synth 8-3352] multi-driven net cpu_inst/imem_inst/instrT[3] with 2nd driver pin 'cpu_inst/imem_inst/imem_ip/spo[3]' [E:/github/cpu31/project_1/project_1.srcs/sources_1/new/IMEMtop.v:28]
CRITICAL WARNING: [Synth 8-3352] multi-driven net cpu_inst/imem_inst/instrT[19] with 1st driver pin 'cpu_inst/sccpu/imem_inst/imem_ip/spo[19]' [E:/github/cpu31/project_1/project_1.srcs/sources_1/new/IMEMtop.v:28]
CRITICAL WARNING: [Synth 8-3352] multi-driven net cpu_inst/imem_inst/instrT[19] with 2nd driver pin 'cpu_inst/imem_inst/imem_ip/spo[19]' [E:/github/cpu31/project_1/project_1.srcs/sources_1/new/IMEMtop.v:28]
CRITICAL WARNING: [Synth 8-3352] multi-driven net cpu_inst/imem_inst/instrT[18] with 1st driver pin 'cpu_inst/sccpu/imem_inst/imem_ip/spo[18]' [E:/github/cpu31/project_1/project_1.srcs/sources_1/new/IMEMtop.v:28]
CRITICAL WARNING: [Synth 8-3352] multi-driven net cpu_inst/imem_inst/instrT[18] with 2nd driver pin 'cpu_inst/imem_inst/imem_ip/spo[18]' [E:/github/cpu31/project_1/project_1.srcs/sources_1/new/IMEMtop.v:28]
CRITICAL WARNING: [Synth 8-3352] multi-driven net cpu_inst/imem_inst/instrT[17] with 1st driver pin 'cpu_inst/sccpu/imem_inst/imem_ip/spo[17]' [E:/github/cpu31/project_1/project_1.srcs/sources_1/new/IMEMtop.v:28]
CRITICAL WARNING: [Synth 8-3352] multi-driven net cpu_inst/imem_inst/instrT[17] with 2nd driver pin 'cpu_inst/imem_inst/imem_ip/spo[17]' [E:/github/cpu31/project_1/project_1.srcs/sources_1/new/IMEMtop.v:28]
CRITICAL WARNING: [Synth 8-3352] multi-driven net cpu_inst/imem_inst/instrT[16] with 1st driver pin 'cpu_inst/sccpu/imem_inst/imem_ip/spo[16]' [E:/github/cpu31/project_1/project_1.srcs/sources_1/new/IMEMtop.v:28]
CRITICAL WARNING: [Synth 8-3352] multi-driven net cpu_inst/imem_inst/instrT[16] with 2nd driver pin 'cpu_inst/imem_inst/imem_ip/spo[16]' [E:/github/cpu31/project_1/project_1.srcs/sources_1/new/IMEMtop.v:28]
CRITICAL WARNING: [Synth 8-3352] multi-driven net cpu_inst/imem_inst/instrT[24] with 1st driver pin 'cpu_inst/sccpu/imem_inst/imem_ip/spo[24]' [E:/github/cpu31/project_1/project_1.srcs/sources_1/new/IMEMtop.v:28]
CRITICAL WARNING: [Synth 8-3352] multi-driven net cpu_inst/imem_inst/instrT[24] with 2nd driver pin 'cpu_inst/imem_inst/imem_ip/spo[24]' [E:/github/cpu31/project_1/project_1.srcs/sources_1/new/IMEMtop.v:28]
CRITICAL WARNING: [Synth 8-3352] multi-driven net cpu_inst/imem_inst/instrT[23] with 1st driver pin 'cpu_inst/sccpu/imem_inst/imem_ip/spo[23]' [E:/github/cpu31/project_1/project_1.srcs/sources_1/new/IMEMtop.v:28]
CRITICAL WARNING: [Synth 8-3352] multi-driven net cpu_inst/imem_inst/instrT[23] with 2nd driver pin 'cpu_inst/imem_inst/imem_ip/spo[23]' [E:/github/cpu31/project_1/project_1.srcs/sources_1/new/IMEMtop.v:28]
CRITICAL WARNING: [Synth 8-3352] multi-driven net cpu_inst/imem_inst/instrT[22] with 1st driver pin 'cpu_inst/sccpu/imem_inst/imem_ip/spo[22]' [E:/github/cpu31/project_1/project_1.srcs/sources_1/new/IMEMtop.v:28]
CRITICAL WARNING: [Synth 8-3352] multi-driven net cpu_inst/imem_inst/instrT[22] with 2nd driver pin 'cpu_inst/imem_inst/imem_ip/spo[22]' [E:/github/cpu31/project_1/project_1.srcs/sources_1/new/IMEMtop.v:28]
CRITICAL WARNING: [Synth 8-3352] multi-driven net cpu_inst/imem_inst/instrT[21] with 1st driver pin 'cpu_inst/sccpu/imem_inst/imem_ip/spo[21]' [E:/github/cpu31/project_1/project_1.srcs/sources_1/new/IMEMtop.v:28]
CRITICAL WARNING: [Synth 8-3352] multi-driven net cpu_inst/imem_inst/instrT[21] with 2nd driver pin 'cpu_inst/imem_inst/imem_ip/spo[21]' [E:/github/cpu31/project_1/project_1.srcs/sources_1/new/IMEMtop.v:28]
CRITICAL WARNING: [Synth 8-3352] multi-driven net cpu_inst/imem_inst/instrT[31] with 1st driver pin 'cpu_inst/sccpu/imem_inst/imem_ip/spo[31]' [E:/github/cpu31/project_1/project_1.srcs/sources_1/new/IMEMtop.v:28]
CRITICAL WARNING: [Synth 8-3352] multi-driven net cpu_inst/imem_inst/instrT[31] with 2nd driver pin 'cpu_inst/imem_inst/imem_ip/spo[31]' [E:/github/cpu31/project_1/project_1.srcs/sources_1/new/IMEMtop.v:28]
CRITICAL WARNING: [Synth 8-3352] multi-driven net n_0_2146 with 1st driver pin 'i_2146/O' [E:/github/cpu31/project_1/project_1.srcs/sources_1/new/pc.v:22]
CRITICAL WARNING: [Synth 8-3352] multi-driven net n_0_2146 with 2nd driver pin 'i_2114/O' [E:/github/cpu31/project_1/project_1.srcs/sources_1/new/pc.v:22]
CRITICAL WARNING: [Synth 8-3352] multi-driven net cpu_inst/imem_inst/instrT[15] with 1st driver pin 'cpu_inst/sccpu/imem_inst/imem_ip/spo[15]' [E:/github/cpu31/project_1/project_1.srcs/sources_1/new/IMEMtop.v:28]
CRITICAL WARNING: [Synth 8-3352] multi-driven net cpu_inst/imem_inst/instrT[15] with 2nd driver pin 'cpu_inst/imem_inst/imem_ip/spo[15]' [E:/github/cpu31/project_1/project_1.srcs/sources_1/new/IMEMtop.v:28]
CRITICAL WARNING: [Synth 8-3352] multi-driven net cpu_inst/imem_inst/instrT[26] with 1st driver pin 'cpu_inst/sccpu/imem_inst/imem_ip/spo[26]' [E:/github/cpu31/project_1/project_1.srcs/sources_1/new/IMEMtop.v:28]
CRITICAL WARNING: [Synth 8-3352] multi-driven net cpu_inst/imem_inst/instrT[26] with 2nd driver pin 'cpu_inst/imem_inst/imem_ip/spo[26]' [E:/github/cpu31/project_1/project_1.srcs/sources_1/new/IMEMtop.v:28]
CRITICAL WARNING: [Synth 8-3352] multi-driven net n_0_2147 with 1st driver pin 'i_2147/O' [E:/github/cpu31/project_1/project_1.srcs/sources_1/new/pc.v:22]
CRITICAL WARNING: [Synth 8-3352] multi-driven net n_0_2147 with 2nd driver pin 'i_2115/O' [E:/github/cpu31/project_1/project_1.srcs/sources_1/new/pc.v:22]
CRITICAL WARNING: [Synth 8-3352] multi-driven net n_0_2148 with 1st driver pin 'i_2148/O' [E:/github/cpu31/project_1/project_1.srcs/sources_1/new/pc.v:22]
CRITICAL WARNING: [Synth 8-3352] multi-driven net n_0_2148 with 2nd driver pin 'i_2116/O' [E:/github/cpu31/project_1/project_1.srcs/sources_1/new/pc.v:22]
CRITICAL WARNING: [Synth 8-3352] multi-driven net n_0_2149 with 1st driver pin 'i_2149/O' [E:/github/cpu31/project_1/project_1.srcs/sources_1/new/pc.v:22]
CRITICAL WARNING: [Synth 8-3352] multi-driven net n_0_2149 with 2nd driver pin 'i_2117/O' [E:/github/cpu31/project_1/project_1.srcs/sources_1/new/pc.v:22]
CRITICAL WARNING: [Synth 8-3352] multi-driven net n_0_2150 with 1st driver pin 'i_2150/O' [E:/github/cpu31/project_1/project_1.srcs/sources_1/new/pc.v:22]
CRITICAL WARNING: [Synth 8-3352] multi-driven net n_0_2150 with 2nd driver pin 'i_2118/O' [E:/github/cpu31/project_1/project_1.srcs/sources_1/new/pc.v:22]
CRITICAL WARNING: [Synth 8-3352] multi-driven net n_0_2151 with 1st driver pin 'i_2151/O' [E:/github/cpu31/project_1/project_1.srcs/sources_1/new/pc.v:22]
CRITICAL WARNING: [Synth 8-3352] multi-driven net n_0_2151 with 2nd driver pin 'i_2119/O' [E:/github/cpu31/project_1/project_1.srcs/sources_1/new/pc.v:22]
CRITICAL WARNING: [Synth 8-3352] multi-driven net n_0_2152 with 1st driver pin 'i_2152/O' [E:/github/cpu31/project_1/project_1.srcs/sources_1/new/pc.v:22]
CRITICAL WARNING: [Synth 8-3352] multi-driven net n_0_2152 with 2nd driver pin 'i_2120/O' [E:/github/cpu31/project_1/project_1.srcs/sources_1/new/pc.v:22]
CRITICAL WARNING: [Synth 8-3352] multi-driven net n_0_2153 with 1st driver pin 'i_2153/O' [E:/github/cpu31/project_1/project_1.srcs/sources_1/new/pc.v:22]
CRITICAL WARNING: [Synth 8-3352] multi-driven net n_0_2153 with 2nd driver pin 'i_2121/O' [E:/github/cpu31/project_1/project_1.srcs/sources_1/new/pc.v:22]
CRITICAL WARNING: [Synth 8-3352] multi-driven net n_0_2154 with 1st driver pin 'i_2154/O' [E:/github/cpu31/project_1/project_1.srcs/sources_1/new/pc.v:22]
CRITICAL WARNING: [Synth 8-3352] multi-driven net n_0_2154 with 2nd driver pin 'i_2122/O' [E:/github/cpu31/project_1/project_1.srcs/sources_1/new/pc.v:22]
CRITICAL WARNING: [Synth 8-3352] multi-driven net n_0_2155 with 1st driver pin 'i_2155/O' [E:/github/cpu31/project_1/project_1.srcs/sources_1/new/pc.v:22]
CRITICAL WARNING: [Synth 8-3352] multi-driven net n_0_2155 with 2nd driver pin 'i_2123/O' [E:/github/cpu31/project_1/project_1.srcs/sources_1/new/pc.v:22]
CRITICAL WARNING: [Synth 8-3352] multi-driven net n_0_2156 with 1st driver pin 'i_2156/O' [E:/github/cpu31/project_1/project_1.srcs/sources_1/new/pc.v:22]
CRITICAL WARNING: [Synth 8-3352] multi-driven net n_0_2156 with 2nd driver pin 'i_2124/O' [E:/github/cpu31/project_1/project_1.srcs/sources_1/new/pc.v:22]
CRITICAL WARNING: [Synth 8-3352] multi-driven net n_0_2157 with 1st driver pin 'i_2157/O' [E:/github/cpu31/project_1/project_1.srcs/sources_1/new/pc.v:22]
CRITICAL WARNING: [Synth 8-3352] multi-driven net n_0_2157 with 2nd driver pin 'i_2125/O' [E:/github/cpu31/project_1/project_1.srcs/sources_1/new/pc.v:22]
CRITICAL WARNING: [Synth 8-3352] multi-driven net n_0_2144 with 1st driver pin 'i_2144/O' [E:/github/cpu31/project_1/project_1.srcs/sources_1/new/pc.v:22]
CRITICAL WARNING: [Synth 8-3352] multi-driven net n_0_2144 with 2nd driver pin 'i_2112/O' [E:/github/cpu31/project_1/project_1.srcs/sources_1/new/pc.v:22]
CRITICAL WARNING: [Synth 8-3352] multi-driven net n_0_2145 with 1st driver pin 'i_2145/O' [E:/github/cpu31/project_1/project_1.srcs/sources_1/new/pc.v:22]
CRITICAL WARNING: [Synth 8-3352] multi-driven net n_0_2145 with 2nd driver pin 'i_2113/O' [E:/github/cpu31/project_1/project_1.srcs/sources_1/new/pc.v:22]
CRITICAL WARNING: [Synth 8-3352] multi-driven net n_0_2142 with 1st driver pin 'i_2142/O' [E:/github/cpu31/project_1/project_1.srcs/sources_1/new/pc.v:22]
CRITICAL WARNING: [Synth 8-3352] multi-driven net n_0_2142 with 2nd driver pin 'i_2110/O' [E:/github/cpu31/project_1/project_1.srcs/sources_1/new/pc.v:22]
CRITICAL WARNING: [Synth 8-3352] multi-driven net n_0_2143 with 1st driver pin 'i_2143/O' [E:/github/cpu31/project_1/project_1.srcs/sources_1/new/pc.v:22]
CRITICAL WARNING: [Synth 8-3352] multi-driven net n_0_2143 with 2nd driver pin 'i_2111/O' [E:/github/cpu31/project_1/project_1.srcs/sources_1/new/pc.v:22]
CRITICAL WARNING: [Synth 8-3352] multi-driven net n_0_2136 with 1st driver pin 'i_2136/O' [E:/github/cpu31/project_1/project_1.srcs/sources_1/new/pc.v:22]
CRITICAL WARNING: [Synth 8-3352] multi-driven net n_0_2136 with 2nd driver pin 'i_2104/O' [E:/github/cpu31/project_1/project_1.srcs/sources_1/new/pc.v:22]
CRITICAL WARNING: [Synth 8-3352] multi-driven net n_0_2137 with 1st driver pin 'i_2137/O' [E:/github/cpu31/project_1/project_1.srcs/sources_1/new/pc.v:22]
CRITICAL WARNING: [Synth 8-3352] multi-driven net n_0_2137 with 2nd driver pin 'i_2105/O' [E:/github/cpu31/project_1/project_1.srcs/sources_1/new/pc.v:22]
CRITICAL WARNING: [Synth 8-3352] multi-driven net n_0_2138 with 1st driver pin 'i_2138/O' [E:/github/cpu31/project_1/project_1.srcs/sources_1/new/pc.v:22]
CRITICAL WARNING: [Synth 8-3352] multi-driven net n_0_2138 with 2nd driver pin 'i_2106/O' [E:/github/cpu31/project_1/project_1.srcs/sources_1/new/pc.v:22]
CRITICAL WARNING: [Synth 8-3352] multi-driven net n_0_2139 with 1st driver pin 'i_2139/O' [E:/github/cpu31/project_1/project_1.srcs/sources_1/new/pc.v:22]
CRITICAL WARNING: [Synth 8-3352] multi-driven net n_0_2139 with 2nd driver pin 'i_2107/O' [E:/github/cpu31/project_1/project_1.srcs/sources_1/new/pc.v:22]
CRITICAL WARNING: [Synth 8-3352] multi-driven net n_0_2140 with 1st driver pin 'i_2140/O' [E:/github/cpu31/project_1/project_1.srcs/sources_1/new/pc.v:22]
CRITICAL WARNING: [Synth 8-3352] multi-driven net n_0_2140 with 2nd driver pin 'i_2108/O' [E:/github/cpu31/project_1/project_1.srcs/sources_1/new/pc.v:22]
CRITICAL WARNING: [Synth 8-3352] multi-driven net n_0_2141 with 1st driver pin 'i_2141/O' [E:/github/cpu31/project_1/project_1.srcs/sources_1/new/pc.v:22]
CRITICAL WARNING: [Synth 8-3352] multi-driven net n_0_2141 with 2nd driver pin 'i_2109/O' [E:/github/cpu31/project_1/project_1.srcs/sources_1/new/pc.v:22]
CRITICAL WARNING: [Synth 8-3352] multi-driven net n_0_2134 with 1st driver pin 'i_2134/O' [E:/github/cpu31/project_1/project_1.srcs/sources_1/new/pc.v:22]
CRITICAL WARNING: [Synth 8-3352] multi-driven net n_0_2134 with 2nd driver pin 'i_2102/O' [E:/github/cpu31/project_1/project_1.srcs/sources_1/new/pc.v:22]
CRITICAL WARNING: [Synth 8-3352] multi-driven net n_0_2135 with 1st driver pin 'i_2135/O' [E:/github/cpu31/project_1/project_1.srcs/sources_1/new/pc.v:22]
CRITICAL WARNING: [Synth 8-3352] multi-driven net n_0_2135 with 2nd driver pin 'i_2103/O' [E:/github/cpu31/project_1/project_1.srcs/sources_1/new/pc.v:22]
CRITICAL WARNING: [Synth 8-3352] multi-driven net n_0_2130 with 1st driver pin 'i_2130/O' [E:/github/cpu31/project_1/project_1.srcs/sources_1/new/pc.v:22]
CRITICAL WARNING: [Synth 8-3352] multi-driven net n_0_2130 with 2nd driver pin 'i_2098/O' [E:/github/cpu31/project_1/project_1.srcs/sources_1/new/pc.v:22]
INFO: [Common 17-14] Message 'Synth 8-3352' appears 100 times and further instances of the messages will be disabled. Use the Tcl command set_msg_config to change the current settings.

Report Check Netlist: 
+------+------------------+-------+---------+-------+------------------+
|      |Item              |Errors |Warnings |Status |Description       |
+------+------------------+-------+---------+-------+------------------+
|1     |multi_driven_nets |      0|       64|Failed |Multi driven nets |
+------+------------------+-------+---------+-------+------------------+
---------------------------------------------------------------------------------
Start Renaming Generated Instances
---------------------------------------------------------------------------------
---------------------------------------------------------------------------------
Finished Renaming Generated Instances : Time (s): cpu = 00:00:45 ; elapsed = 00:00:52 . Memory (MB): peak = 725.176 ; gain = 517.816
---------------------------------------------------------------------------------

Report RTL Partitions: 
+-+--------------+------------+----------+
| |RTL Partition |Replication |Instances |
+-+--------------+------------+----------+
+-+--------------+------------+----------+
---------------------------------------------------------------------------------
Start Rebuilding User Hierarchy
---------------------------------------------------------------------------------
---------------------------------------------------------------------------------
Finished Rebuilding User Hierarchy : Time (s): cpu = 00:00:45 ; elapsed = 00:00:52 . Memory (MB): peak = 725.176 ; gain = 517.816
---------------------------------------------------------------------------------
---------------------------------------------------------------------------------
Start Renaming Generated Ports
---------------------------------------------------------------------------------
---------------------------------------------------------------------------------
Finished Renaming Generated Ports : Time (s): cpu = 00:00:45 ; elapsed = 00:00:52 . Memory (MB): peak = 725.176 ; gain = 517.816
---------------------------------------------------------------------------------
---------------------------------------------------------------------------------
Start Handling Custom Attributes
---------------------------------------------------------------------------------
---------------------------------------------------------------------------------
Finished Handling Custom Attributes : Time (s): cpu = 00:00:45 ; elapsed = 00:00:52 . Memory (MB): peak = 725.176 ; gain = 517.816
---------------------------------------------------------------------------------
---------------------------------------------------------------------------------
Start Renaming Generated Nets
---------------------------------------------------------------------------------
---------------------------------------------------------------------------------
Finished Renaming Generated Nets : Time (s): cpu = 00:00:46 ; elapsed = 00:00:52 . Memory (MB): peak = 725.176 ; gain = 517.816
---------------------------------------------------------------------------------
---------------------------------------------------------------------------------
Start Writing Synthesis Report
---------------------------------------------------------------------------------

Report BlackBoxes: 
+------+--------------+----------+
|      |BlackBox name |Instances |
+------+--------------+----------+
|1     |divider       |         1|
|2     |imem          |         2|
+------+--------------+----------+

Report Cell Usage: 
+------+----------+------+
|      |Cell      |Count |
+------+----------+------+
|1     |divider   |     1|
|2     |imem      |     1|
|3     |imem__2   |     1|
|4     |CARRY4    |    75|
|5     |LUT1      |   105|
|6     |LUT2      |   117|
|7     |LUT3      |    44|
|8     |LUT4      |   248|
|9     |LUT5      |   255|
|10    |LUT6      |  1415|
|11    |MUXF7     |   336|
|12    |MUXF8     |    93|
|13    |RAM256X1S |   256|
|14    |FDCE      |  1106|
|15    |FDPE      |     7|
|16    |IBUF      |     2|
|17    |OBUF      |    16|
+------+----------+------+

Report Instance Areas: 
+------+--------------------+----------------+------+
|      |Instance            |Module          |Cells |
+------+--------------------+----------------+------+
|1     |top                 |                |  4141|
|2     |  cpu_inst          |sccomp_dataflow |  3973|
|3     |    dmem_inst       |DMEM            |   518|
|4     |    imem_inst       |IMEM            |    32|
|5     |    sccpu           |cpu             |  3418|
|6     |      cpu_ref       |regfile         |  3086|
|7     |      imem_inst     |IMEM_0          |    32|
|8     |      mux1_inst     |mux1            |     9|
|9     |      mux2_inst     |mux2            |     3|
|10    |      npcmaker_inst |npcmaker        |    30|
|11    |      pc_inst       |pcreg           |   134|
+------+--------------------+----------------+------+
---------------------------------------------------------------------------------
Finished Writing Synthesis Report : Time (s): cpu = 00:00:46 ; elapsed = 00:00:52 . Memory (MB): peak = 725.176 ; gain = 517.816
---------------------------------------------------------------------------------
Synthesis finished with 0 errors, 129 critical warnings and 1 warnings.
Synthesis Optimization Runtime : Time (s): cpu = 00:00:39 ; elapsed = 00:00:44 . Memory (MB): peak = 725.176 ; gain = 172.734
INFO: Vivado Synthesis caught shared memory exception ''. Continuing without using shared memory (or continuing without parallel flow)
Synthesis Optimization Complete : Time (s): cpu = 00:00:46 ; elapsed = 00:00:52 . Memory (MB): peak = 725.176 ; gain = 517.816
INFO: [Project 1-571] Translating synthesized netlist
INFO: [Netlist 29-17] Analyzing 333 Unisim elements for replacement
INFO: [Netlist 29-28] Unisim Transformation completed in 0 CPU seconds
INFO: [Project 1-570] Preparing netlist for logic optimization
INFO: [Opt 31-140] Inserted 1 IBUFs to IO ports without IO buffers.
INFO: [Opt 31-138] Pushed 0 inverter(s) to 0 load pin(s).
INFO: [Project 1-111] Unisim Transformation Summary:
  A total of 256 instances were transformed.
  RAM256X1S => RAM256X1S (MUXF7, MUXF7, MUXF8, RAMS64E, RAMS64E, RAMS64E, RAMS64E): 256 instances

INFO: [Common 17-83] Releasing license: Synthesis
107 Infos, 58 Warnings, 103 Critical Warnings and 0 Errors encountered.
synth_design completed successfully
synth_design: Time (s): cpu = 00:00:45 ; elapsed = 00:00:49 . Memory (MB): peak = 725.176 ; gain = 493.367
report_utilization: Time (s): cpu = 00:00:00 ; elapsed = 00:00:00.021 . Memory (MB): peak = 725.176 ; gain = 0.000
INFO: [Common 17-206] Exiting Vivado at Tue May 20 14:58:03 2025...
